status,title,company,location,date,blurb,tags,link,id,provider,query,locale,wage,remotenessNEW,"AI: Data Analytics Consulting, Director",NTT DATA,"Plano, TX 75086",2024-11-20,"10+ years hands-on experience working with large scale data solutions; covering strategy, data preparation, data quality, ETL, data viz. Collaborate with cross-functional teams, including data…","Job types: Full-time
Job types cc: Full-time",https://www.indeed.com/m/viewjob?jk=cff04aec150f97ca,IndeedScraperUSAEng_cff04aec150f97ca,IndeedScraperUSAEng,Data,USA_ENGLISH,,UNKNOWN
NEW,Lead Independent Testing Officer - Customer Remediation Validation Data Management (SQL/SAS),Wells Fargo,"Irving, TX",2024-10-27,Partner with CRV team members to educate them on the data received and design strategies to analyze the data including creation of data subsets or calculated fields.,"Job types: Full-time
Remote: Hybrid work
Benefits: Commuter assistance, Caregiver leave, Disability insurance, Dependent care reimbursement, Health insurance, Tuition reimbursement, Paid time off, Parental leave, Life insurance
Job types cc: Full-time",https://www.indeed.com/m/viewjob?jk=54fca39cd34d6c7a,IndeedScraperUSAEng_54fca39cd34d6c7a,IndeedScraperUSAEng,Data,USA_ENGLISH,$111100 - $197500 yearly,TEMPORARILY_REMOTE
NEW,Data Scientist,Jeevan Technologies,"Dallas, TX",2024-10-27,"Data Analysis, advanced analytics, data Science, Machine learning, AI or optimization project experience. Dallas, TX / Onsite looking only local candidate as required final round F2F *.","Job types: Contract
Job types cc: Contract",https://www.indeed.com/m/viewjob?jk=aab3570b05c1a376,IndeedScraperUSAEng_aab3570b05c1a376,IndeedScraperUSAEng,Data,USA_ENGLISH,$55 - $65 hourly,UNKNOWN
NEW,Cyber Risk Data Privacy Manager,Deloitte,"Dallas, TX",2024-11-23,"Work alongside practice leaders and experienced privacy technology professionals gaining industry-leading insights into data privacy. Ability to understand, develop and enhance existing client…","Job types: Full-time
Job types cc: Full-time",https://www.indeed.com/m/viewjob?jk=4fcaa93ead746420,IndeedScraperUSAEng_4fcaa93ead746420,IndeedScraperUSAEng,Data,USA_ENGLISH,$124616 - $240488 yearly,UNKNOWN
NEW,Home Loans Senior Data Analyst,SoFi,"Frisco, TX",2024-10-27,"In this critical role, you will manage a residential mortgage portfolio, orchestrating efforts with product managers and multidisciplinary teams. Facilitate high-level technical communication across…",,https://www.indeed.com/m/viewjob?jk=e1006f449b444a82,IndeedScraperUSAEng_e1006f449b444a82,IndeedScraperUSAEng,Data,USA_ENGLISH,,UNKNOWN
NEW,Machine Learning Engineer - REMOTE,NTT DATA,"Plano, TX 75086",2024-11-08,Experience analyzing large-scale data and delivering insights. Collaborate with existing machine learning engineers and data scientists and backend engineers from cross-functional teams.,"Remote: Remote
Benefits: Health savings account, AD&D insurance, Disability insurance, Health insurance, Dental insurance, Paid time off, Vision insurance, 401(k) matching",https://www.indeed.com/m/viewjob?jk=4b09f13fa17aa58f,IndeedScraperUSAEng_4b09f13fa17aa58f,IndeedScraperUSAEng,Data,USA_ENGLISH,$108472 - $251094 yearly,FULLY_REMOTE
NEW,Azure ML-Big Data Engineer,INCLINED INC,"Dallas, TX",2024-10-27,"Design, Development, Unit and Integration testing of complex data pipelines and to handle data volumes to derive insights. Role:- Azure ML-Big Data Engineer.",,https://www.indeed.com/m/viewjob?jk=731af44437b15b97,IndeedScraperUSAEng_731af44437b15b97,IndeedScraperUSAEng,Data,USA_ENGLISH,,UNKNOWN
NEW,"Manager, Business Analytics & Reporting",Match Group,"Dallas, TX 75231",2024-10-27,"As a Manager, Business Analytics & Reporting, you will extract critical data from multiple data sources across the Match Group portfolio and use your deep technical skills to develop reporting…","Job types: Full-time
Remote: Hybrid work
Benefits: Paid parental leave, Employee stock purchase plan, Paid holidays, Happy hour, Paid time off, Parental leave, 401(k) matching, Pet insurance
Job types cc: Full-time",https://www.indeed.com/m/viewjob?jk=ce11e3fb63ef3388,IndeedScraperUSAEng_ce11e3fb63ef3388,IndeedScraperUSAEng,Data,USA_ENGLISH,$122000 - $160000 yearly,TEMPORARILY_REMOTE
NEW,"Director, Data Modeling",Fidelity Investments,"Westlake, TX 76262",2024-10-27,"The Team, Workplace Investments data modeling team, partners with the project teams to deliver practical & resilient data models and database designs that meet business needs while adhering to…",,https://www.indeed.com/m/viewjob?jk=04db540f54577c8f,IndeedScraperUSAEng_04db540f54577c8f,IndeedScraperUSAEng,Data,USA_ENGLISH,,UNKNOWN
NEW,Data Analytics Architect,Anblicks,"Dallas, TX",2024-10-27,"Work with other data science and analytics teams to create and implement data strategies, design data pipelines, and develop data models and data products.","Job types: Full-time
Job types cc: Full-time",https://www.indeed.com/m/viewjob?jk=9c7b57eba6d74031,IndeedScraperUSAEng_9c7b57eba6d74031,IndeedScraperUSAEng,Data,USA_ENGLISH,,UNKNOWN
NEW,Sr MDM Data Engineer - Remote,NiSource,"Fort Worth, TX 76107",2024-10-27,"3+ years building and optimizing big-data pipelines, architectures and data sets. Working knowledge of message queuing, stream processing, and highly scalable ‘big data’ data stores.","Job types: Full-time
Remote: Remote
Job types cc: Full-time",https://www.indeed.com/m/viewjob?jk=2dd52d3163497dee,IndeedScraperUSAEng_2dd52d3163497dee,IndeedScraperUSAEng,Data,USA_ENGLISH,$77400 - $116200 yearly,FULLY_REMOTE
NEW,Data Analyst,Everlight Solar,"Fort Worth, TX",2024-11-07,Develop and implement data collection systems and other strategies that optimize statistical efficiency and data quality. Work with large amounts of data to draw meaningful conclusions.,"Job types: Full-time
Remote: Remote
Benefits: Paid holidays, Dental insurance, Paid time off, Vision insurance, Life insurance
Job types cc: Full-time",https://www.indeed.com/m/viewjob?jk=d90a1b1dd5e63e9c,IndeedScraperUSAEng_d90a1b1dd5e63e9c,IndeedScraperUSAEng,Data,USA_ENGLISH,$65000 - $100000 yearly,FULLY_REMOTE
NEW,Solutions Architect - Data,Long View Systems,"Dallas, TX",2024-10-27,"10+ years in industry working as a developer and subject matter expert in data analytics with Azure. Utilizing your deep and expert knowledge in Azure and Data Analytics, you understand client…","Remote: Hybrid work
Benefits: Paid training",https://www.indeed.com/m/viewjob?jk=72fbb7100061fc49,IndeedScraperUSAEng_72fbb7100061fc49,IndeedScraperUSAEng,Data,USA_ENGLISH,$122000 - $160500 yearly,TEMPORARILY_REMOTE
NEW,Data Governance Lead,Integration Developer Network LLC,"Irving, TX 75062",2024-10-27,"Deep understanding of data governance capabilities including data catalog, data dictionary, business lineage, technical lineage and stewardship workflows. Irving, Texas, United States (On-site).","Job types: Contract
Shifts: 8 hour shift
Job types cc: Contract
Schedules: 8 hour shift",https://www.indeed.com/m/viewjob?jk=7f3c3c70b40510f1,IndeedScraperUSAEng_7f3c3c70b40510f1,IndeedScraperUSAEng,Data,USA_ENGLISH,,UNKNOWN
NEW,AI & GenAI Data Scientist-Manager,PRICE WATERHOUSE COOPERS,"Dallas, TX",2024-11-20,"Directing data engineers and other data scientists to deliver efficient solutions to meet client requirements; In data analysis at PwC, you will focus on utilising advanced analytical techniques to…","Benefits: Paid holidays, Health insurance, Dental insurance, 401(k), Vision insurance",https://www.indeed.com/m/viewjob?jk=321616b14dc4ef8a,IndeedScraperUSAEng_321616b14dc4ef8a,IndeedScraperUSAEng,Data,USA_ENGLISH,$100000 - $232000 yearly,UNKNOWN
NEW,"Data Scientist, Sr. Associate - Business Banking",JPMorganChase,"Plano, TX 75024",2024-11-23,"The team encompasses a variety of disciplines from data governance and strategy to reporting, data science and machine learning. Navigate large amounts of data from multiple sources, utilizing Python…","Job types: Full-time
Benefits: Health insurance, Tuition reimbursement, Retirement plan
Job types cc: Full-time",https://www.indeed.com/m/viewjob?jk=6407c31d86ef7a7d,IndeedScraperUSAEng_6407c31d86ef7a7d,IndeedScraperUSAEng,Data,USA_ENGLISH,,UNKNOWN
NEW,"Business Analyst, Global Maintenance Automation Platform (MAP)",Amazon.com Services LLC,"Dallas, TX",2024-10-27,"The complexity of this role extends far beyond basic data entry and extraction; it involves designing and developing automated data pipelines, creating sophisticated analytical models, and crafting…","Job types: Full-time
Benefits: Health insurance, Dental insurance, Paid time off, Parental leave, Vision insurance
Job types cc: Full-time",https://www.indeed.com/m/viewjob?jk=523cf2a5bc98fa75,IndeedScraperUSAEng_523cf2a5bc98fa75,IndeedScraperUSAEng,Data,USA_ENGLISH,$66900 - $143100 yearly,UNKNOWN
NEW,Data Engineering - Core Data Platform - Software Engineer - Associate - Dallas,Goldman Sachs,"Dallas, TX 75201",2024-11-05,"General knowledge of business processes, data flows and the quantitative models that generate or consume data. We tackle some of the most complex engineering problems across distributed software…",,https://www.indeed.com/m/viewjob?jk=330ed4b21e22d730,IndeedScraperUSAEng_330ed4b21e22d730,IndeedScraperUSAEng,Data,USA_ENGLISH,,UNKNOWN
NEW,Winter 2025 Co-op - Logistics Data Analyst,Keurig Dr Pepper,"Frisco, TX",2024-11-09,"The primary purpose of this role is to optimize network performance visibility through dashboarding and data analysis. As a Winter Co-op at Keurig Dr Pepper (KDP), you will be a part of the beverage…","Job types: Full-time
Benefits: Health insurance, Lunch & learns
Job types cc: Full-time
Schedules: Monday to Friday",https://www.indeed.com/m/viewjob?jk=edff22fc94bb172e,IndeedScraperUSAEng_edff22fc94bb172e,IndeedScraperUSAEng,Data,USA_ENGLISH,,UNKNOWN
NEW,2025 Advancing Black Pathways Fellowship Program - Data Science Track,JPMorganChase,"Plano, TX 75023",2024-11-23,"Data Analysis: Learn how we use advanced data science methods to analyze and interpret complex data sets. The Advancing Black Pathways (ABP) Fellowship Program, offers a five-week paid, full-time…","Job types: Full-time
Job types cc: Full-time",https://www.indeed.com/m/viewjob?jk=72fdf3bf1398e3d8,IndeedScraperUSAEng_72fdf3bf1398e3d8,IndeedScraperUSAEng,Data,USA_ENGLISH,$26.45 - $26.45 hourly,UNKNOWN
NEW,Field Representative - Part Time,RetailData LLC,"Dallas, TX",2024-11-09,"On the agreed schedule that you set in partnership with your manager, you will be asked use our company app to record prescribed product information. Once you have successfully met the criteria of the…","Job types: Part-time
Benefits: Mileage reimbursement, 401(k) matching, Flexible schedule, Pet insurance
Job types cc: Part-time",https://www.indeed.com/m/viewjob?jk=57418672a5876ee7,IndeedScraperUSAEng_57418672a5876ee7,IndeedScraperUSAEng,Data,USA_ENGLISH,,UNKNOWN
NEW,Field Representative - Part Time,RetailData LLC,"Dallas, TX",2024-11-09,"On the agreed schedule that you set in partnership with your manager, you will be asked use our company app to record prescribed product information. Once you have successfully met the criteria of the…","Job types: Part-time
Benefits: Mileage reimbursement, 401(k) matching, Flexible schedule, Pet insurance
Job types cc: Part-time",https://www.indeed.com/m/viewjob?jk=d33ca4e7961246e9,IndeedScraperUSAEng_d33ca4e7961246e9,IndeedScraperUSAEng,Data,USA_ENGLISH,,UNKNOWN
NEW,"Sr Manager, Data and Analytics Lead",Digital Realty,"Dallas, TX",2024-11-21,"Manage and identify data quality and data integrity issues. The Digital Realty Business Intelligence and Data Analytics team is looking for someone with data warehousing, data visualizations and…","Job types: Full-time
Benefits: AD&D insurance, Employee stock purchase plan, Paid holidays, Health insurance, Dental insurance, Tuition reimbursement, Paid time off, Vision insurance, 401(k) matching
Job types cc: Full-time",https://www.indeed.com/m/viewjob?jk=e4b556e3091641c4,IndeedScraperUSAEng_e4b556e3091641c4,IndeedScraperUSAEng,Data,USA_ENGLISH,,UNKNOWN
NEW,Data Engineer,Photon,"Dallas, TX",2024-10-27,"Specialist understanding and experience of methodologies like data warehousing, data visualization and data integration. 6-9 years of related experience in data engineering, analysis, data warehouses,…","Job types: Full-time
Benefits: Paid holidays, Health insurance, Dental insurance, 401(k), Paid time off, Vision insurance
Job types cc: Full-time",https://www.indeed.com/m/viewjob?jk=1eb73ada901b1c59,IndeedScraperUSAEng_1eb73ada901b1c59,IndeedScraperUSAEng,Data,USA_ENGLISH,$34000 - $137000 yearly,UNKNOWN
NEW,Lecturer of Data Science,University of North Texas,"Denton, TX 76203",2024-10-27,"Experience in using Python and alternative data analysis languages such as R is required. We are seeking excellent candidates with interests in a wide range of topics within the mathematical,…","Job types: Full-time
Job types cc: Full-time, Non-tenure",https://www.indeed.com/m/viewjob?jk=8fba986a8ca4e4fe,IndeedScraperUSAEng_8fba986a8ca4e4fe,IndeedScraperUSAEng,Data,USA_ENGLISH,,UNKNOWN
NEW,Big Data Engineer for AI Training,Outlier,"Dallas, TX",2024-11-10,"We partner with organizations to train AI large language models, helping cutting-edge generative AI models write better code. Projects typically include discrete, highly variable problems that involve…","Job types: Contract
Job types cc: Contract, Freelance
Schedules: Overtime",https://www.indeed.com/m/viewjob?jk=cb24f3ae091ba57c,IndeedScraperUSAEng_cb24f3ae091ba57c,IndeedScraperUSAEng,Data,USA_ENGLISH,$30 - $30 hourly,UNKNOWN
NEW,Software Engineer Sr. Synthetic Data,PNC Financial Services Group,"Dallas, TX 75201",2024-10-27,Experience with development around synthetic data models and platforms. Responsibilities require time in the office or in a field on a regular basis. Experience with UI frameworks like Vue preferred.,"Job types: Full-time
Benefits: Wellness program, Health savings account, Paid holidays, Disability insurance, Dependent care reimbursement, Health insurance, Dental insurance, Flexible spending account, Tuition reimbursement, Paid time off, Parental leave, Vision insurance, 401(k) matching, Life insurance, Prescription drug insurance
Job types cc: Full-time",https://www.indeed.com/m/viewjob?jk=be63f3311e808810,IndeedScraperUSAEng_be63f3311e808810,IndeedScraperUSAEng,Data,USA_ENGLISH,,UNKNOWN
NEW,Sr. Lead Data Architect,JPMorganChase,"Plano, TX 75024",2024-11-23,"Excellent experience of several major technology implementation projects, ideally with a strong data orientation all the way from data sourcing and management to remediation at the end of data…","Job types: Full-time
Benefits: Health insurance, Tuition reimbursement, Retirement plan
Job types cc: Full-time",https://www.indeed.com/m/viewjob?jk=f4dee3317bee39b0,IndeedScraperUSAEng_f4dee3317bee39b0,IndeedScraperUSAEng,Data,USA_ENGLISH,,UNKNOWN
NEW,Senior Lead Big Data Developer (Hadoop),Evaya Data Systems,"Allen, TX",2024-10-27,The Lead Big Data Developer is responsible for driving the ingestion of Enterprise data from multiple internal and external heterogenous sources to provide a semantically consistent view of Enterprise…,,https://www.indeed.com/m/viewjob?jk=1c1f752d8a7887f9,IndeedScraperUSAEng_1c1f752d8a7887f9,IndeedScraperUSAEng,Data,USA_ENGLISH,,UNKNOWN
NEW,HPC Data Storage Engineer - TS/SCI,AMERICAN SYSTEMS,"Dallas, TX 75201",2024-10-27,"Manage where data is stored. We are in search of an HPC data storage engineer who will be responsible for the cluster's file and data storage systems, and provide support on-site within a secure…",Benefits: Employee stock ownership plan,https://www.indeed.com/m/viewjob?jk=3bf14e91e9308e55,IndeedScraperUSAEng_3bf14e91e9308e55,IndeedScraperUSAEng,Data,USA_ENGLISH,,UNKNOWN
NEW,Technical Analyst (Data Analytics),"Contact Government Services, LLC","Plano, TX",2024-10-27,"Employment Type: Full-Time, Experienced. Ability to consult with contractors and government management to solve complex litigation support requirements. Client relationship and management experience.","Job types: Full-time
Remote: Hybrid work
Benefits: Health insurance, Dental insurance, 401(k), Flexible spending account, Paid time off, Vision insurance, Life insurance
Job types cc: Full-time",https://www.indeed.com/m/viewjob?jk=2aff4ee536cc6dfc,IndeedScraperUSAEng_2aff4ee536cc6dfc,IndeedScraperUSAEng,Data,USA_ENGLISH,$116480 - $149760 yearly,TEMPORARILY_REMOTE
NEW,Senior Database Engineer (Onsite),Raytheon,"Richardson, TX 75082",2024-10-27,"In this position you would be familiar with creating, updating, and managing Postgres databases and the code that interacts with them. Identify and understand customer needs and apply sound,…","Job types: Full-time
Benefits: Paid holidays, Disability insurance, Relocation assistance, Health insurance, Dental insurance, Flexible spending account, Paid time off, Parental leave, Employee assistance program, Vision insurance, 401(k) matching, Flexible schedule, Life insurance
Job types cc: Full-time",https://www.indeed.com/m/viewjob?jk=66c6843390556f28,IndeedScraperUSAEng_66c6843390556f28,IndeedScraperUSAEng,Data,USA_ENGLISH,$77000 - $163000 yearly,UNKNOWN
NEW,Data Scientist,Amazee Global Ventures Inc,"Dallas, TX",2024-11-14,Data Strategy & Leadership: Define and execute a comprehensive data strategy that aligns data science initiatives with key business goals. Data Governance & Quality: Implement best practices for data…,"Job types: Full-time, Contract
Job types cc: Full-time, Contract",https://www.indeed.com/m/viewjob?jk=d55db52a8063c186,IndeedScraperUSAEng_d55db52a8063c186,IndeedScraperUSAEng,Data,USA_ENGLISH,$55 - $60 hourly,UNKNOWN
NEW,Data Architecture Sr Lead Analyst - SVP,Citi,"Irving, TX",2024-10-27,Strong understanding of data warehousing and data architecture principles. Experience with data visualization tools and data integration platforms. Strong understanding and hold on best practices for…,"Job types: Full-time
Benefits: Paid holidays, Disability insurance, Health insurance, Dental insurance, 401(k), Paid time off, Vision insurance
Job types cc: Full-time",https://www.indeed.com/m/viewjob?jk=6dd103916d235d2d,IndeedScraperUSAEng_6dd103916d235d2d,IndeedScraperUSAEng,Data,USA_ENGLISH,$156160 - $234240 yearly,UNKNOWN
NEW,Technical BA,CAPCO,"Dallas, TX",2024-10-27,"Business process models/design, logical data models, standards and guidance. As Technical Business Analyst, you will be involved with analysis, design, and consulting support, as well as developing an…","Benefits: Health insurance, Dental insurance, 401(k), Tuition reimbursement, Vision insurance",https://www.indeed.com/m/viewjob?jk=36e029a73ada2fbf,IndeedScraperUSAEng_36e029a73ada2fbf,IndeedScraperUSAEng,Data,USA_ENGLISH,,UNKNOWN
NEW,Data Engineer III - ETL & AWS,JPMorganChase,"Plano, TX 75024",2024-11-24,Supports review of controls to ensure sufficient protection of enterprise data. Proactively identifies hidden problems and patterns in data and uses these insights to drive improvements to coding…,"Job types: Full-time
Benefits: Health insurance, Tuition reimbursement, Retirement plan
Job types cc: Full-time",https://www.indeed.com/m/viewjob?jk=9b2c40aff7d59ea2,IndeedScraperUSAEng_9b2c40aff7d59ea2,IndeedScraperUSAEng,Data,USA_ENGLISH,,UNKNOWN
NEW,Senior Business Analyst (Digital),Canyon Ranch,"Fort Worth, TX 76102",2024-10-27,"As part of requirement documentation, capture data and reporting needs for future analysis. Demonstrated skill in providing data management & network development/management support.","Job types: Full-time
Benefits: Paid parental leave, Health insurance, Dental insurance, Parental leave, Employee assistance program, Vision insurance, Life insurance
Job types cc: Full-time",https://www.indeed.com/m/viewjob?jk=11d7b4aa516414ce,IndeedScraperUSAEng_11d7b4aa516414ce,IndeedScraperUSAEng,Data,USA_ENGLISH,,UNKNOWN
NEW,PostgreSQL Database Developer,"Contact Government Services, LLC","Plano, TX",2024-10-27,"Experience implementing and maintaining data warehouses. Create and maintain technical documentation using defined technical documentation templates, as well as gaining an in-depth knowledge of the…","Job types: Full-time
Remote: Hybrid work
Benefits: Health insurance, Dental insurance, 401(k), Flexible spending account, Paid time off, Vision insurance, Life insurance
Job types cc: Full-time",https://www.indeed.com/m/viewjob?jk=2ea8d40cd2c97078,IndeedScraperUSAEng_2ea8d40cd2c97078,IndeedScraperUSAEng,Data,USA_ENGLISH,$106773.33 - $144906.66 yearly,TEMPORARILY_REMOTE
NEW,On-Site Close Out Manager - Data Center,Olsson,"Dallas, TX",2024-10-27,"As an On-Site Close Out Manager, you will be responsible for complex data center construction projects, managing construction processes of contractors on site, implementing and overseeing construction…","Job types: Full-time
Benefits: Wellness program, Health insurance, Dental insurance, Paid time off, Vision insurance, 401(k) matching, Employee stock ownership plan
Job types cc: Full-time",https://www.indeed.com/m/viewjob?jk=7d7e5ffaaae4f2b7,IndeedScraperUSAEng_7d7e5ffaaae4f2b7,IndeedScraperUSAEng,Data,USA_ENGLISH,,UNKNOWN
NEW,Data Engineer,"Contact Government Services, LLC","Plano, TX",2024-10-27,"Experience with developing data pipelines from many sources from structured and unstructured data sets in a variety of formats. Complete development efforts across data pipeline to store, manage,…","Job types: Full-time
Remote: Hybrid work
Benefits: Health insurance, Dental insurance, 401(k), Flexible spending account, Paid time off, Vision insurance, Life insurance
Job types cc: Full-time",https://www.indeed.com/m/viewjob?jk=396db5f42247efc0,IndeedScraperUSAEng_396db5f42247efc0,IndeedScraperUSAEng,Data,USA_ENGLISH,$112597.33 - $152810.66 yearly,TEMPORARILY_REMOTE
NEW,"Data Scientist Dallas, TX / Onsite looking only local candidate as required final round F2F",Pebal Bright Technologies LLC,"Dallas, TX",2024-10-27,"Data Analysis, advanced analytics, data Science, Machine learning, AI or optimization project experience. Dallas, TX / Onsite looking only local candidate as required final round F2F *.","Job types: Contract
Job types cc: Contract",https://www.indeed.com/m/viewjob?jk=df7396fd252e487d,IndeedScraperUSAEng_df7396fd252e487d,IndeedScraperUSAEng,Data,USA_ENGLISH,$55 - $65 hourly,UNKNOWN
NEW,Principal Data Engineer,West Coast University,"Richardson, TX 75080",2024-10-27,"Contributes advanced data integration, data quality, data operations, data platform architecture, and data governance expertise to the Analytical Data Store.",Remote: Hybrid work,https://www.indeed.com/m/viewjob?jk=e1b71ea5ea2bc779,IndeedScraperUSAEng_e1b71ea5ea2bc779,IndeedScraperUSAEng,Data,USA_ENGLISH,$117865.99 - $170910.98 yearly,TEMPORARILY_REMOTE
NEW,Machine Learning Engineer,Photon,"Dallas, TX",2024-10-27,"Extend and augment company data with third-party data to enrich analytics capabilities. Prepare raw data for analysis, including cleaning, imputing missing values, and standardizing data formats using…",,https://www.indeed.com/m/viewjob?jk=6369c91146311623,IndeedScraperUSAEng_6369c91146311623,IndeedScraperUSAEng,Data,USA_ENGLISH,,UNKNOWN
NEW,Pricing Integrity Agent,RetailData LLC,"Fort Worth, TX",2024-11-12,Flexible when you go in and collect the work! We provide detailed training to ensure you will achieve maximum efficiency in each store you will collect. Make a guaranteed hourly minimum!,"Job types: Part-time
Benefits: Mileage reimbursement, 401(k) matching, Flexible schedule, Referral program, Pet insurance
Job types cc: Part-time
Schedules: Choose your own hours",https://www.indeed.com/m/viewjob?jk=3dd50297999beed2,IndeedScraperUSAEng_3dd50297999beed2,IndeedScraperUSAEng,Data,USA_ENGLISH,,UNKNOWN
NEW,Big Data Architect,Evaya Data Systems,"Allen, TX",2024-10-27,"Demonstrated knowledge of enterprise data architecture design methodologies. Should have a broad understanding and have deep experience with distributed data integration solutions, analytics…",,https://www.indeed.com/m/viewjob?jk=c75ee3b36093990f,IndeedScraperUSAEng_c75ee3b36093990f,IndeedScraperUSAEng,Data,USA_ENGLISH,,UNKNOWN
NEW,Data Engineer,"Contact Government Services, LLC","Dallas, TX",2024-10-27,"Experience with developing data pipelines from many sources from structured and unstructured data sets in a variety of formats. Complete development efforts across data pipeline to store, manage,…","Job types: Full-time
Remote: Hybrid work
Benefits: Health insurance, Dental insurance, 401(k), Flexible spending account, Paid time off, Vision insurance, Life insurance
Job types cc: Full-time",https://www.indeed.com/m/viewjob?jk=b622fd296fe10f7a,IndeedScraperUSAEng_b622fd296fe10f7a,IndeedScraperUSAEng,Data,USA_ENGLISH,$112597.33 - $152810.66 yearly,TEMPORARILY_REMOTE
NEW,"AI: Data Analytics Consulting, Director",NTT DATA,"Plano, TX 75086",2024-10-27,"10+ years hands-on experience working with large scale data solutions; covering strategy, data preparation, data quality, ETL, data viz. Collaborate with cross-functional teams, including data…","Job types: Full-time
Remote: Remote
Job types cc: Full-time",https://www.indeed.com/m/viewjob?jk=36640e54c0047fb5,IndeedScraperUSAEng_36640e54c0047fb5,IndeedScraperUSAEng,Data,USA_ENGLISH,$197400 - $329000 yearly,FULLY_REMOTE
