status,title,company,location,date,blurb,tags,link,id,provider,query,locale,wage,remotenessNEW,Analyst - Data,Sms Infocomm Corporation,"Grapevine, TX 76051",2024-11-26,Using analysis data to communicate with production for improved data input correction. Convert data to visual dashboard. Analysis repair data as useful summary. Data communication % of Job 10%.,"Job types: Full-time
Job types cc: Full-time
Schedules: Overtime",https://www.indeed.com/m/viewjob?jk=5adb99986b9caf7a,IndeedScraperUSAEng_5adb99986b9caf7a,IndeedScraperUSAEng,Data,USA_ENGLISH,,UNKNOWN
NEW,Sr. Database Administrator,MUFG Investor Services,"Dallas, TX 75201",2024-10-27,Backup and Recovery: Develop and implement backup and recovery plans to ensure data integrity and availability. Disaster Recovery Analysis and Support: Analyze and develop disaster recovery strategies…,"Job types: Full-time
Job types cc: Full-time",https://www.indeed.com/m/viewjob?jk=47a765030e6c13b2,IndeedScraperUSAEng_47a765030e6c13b2,IndeedScraperUSAEng,Data,USA_ENGLISH,,UNKNOWN
NEW,Data Engineer (Azure),Inclusion Cloud,"Dallas, TX",2024-11-22,Experience with the migration of large sets of data is required. XenApps experience is a must.,,https://www.indeed.com/m/viewjob?jk=cd26d63705ecc7db,IndeedScraperUSAEng_cd26d63705ecc7db,IndeedScraperUSAEng,Data,USA_ENGLISH,,UNKNOWN
NEW,Payor Data Analyst,FlexIT Inc,"Dallas, TX 75240",2024-10-27,"These files need to be reviewed, analyzed and ingested into the data warehouse. Data analyst with a Payor background.","Job types: Full-time
Job types cc: Full-time",https://www.indeed.com/m/viewjob?jk=894a8e13853320a7,IndeedScraperUSAEng_894a8e13853320a7,IndeedScraperUSAEng,Data,USA_ENGLISH,,UNKNOWN
NEW,Data Reconciliation & Transformation Specialist,Deloitte,"Dallas, TX",2024-11-13,Perform detailed analysis of asset and liability data for a financial institution. General knowledge of SQL or other data transformation tools used in the financial services industry.,,https://www.indeed.com/m/viewjob?jk=11f3aa13d213f48c,IndeedScraperUSAEng_11f3aa13d213f48c,IndeedScraperUSAEng,Data,USA_ENGLISH,,UNKNOWN
NEW,SSIS Data Architect,FlexIT Inc,"Dallas, TX 75240",2024-10-27,"Need help with deploying the architecture, developing the roadmap and standing it up. This involves infrastructure automation and CI/CD.","Job types: Full-time
Job types cc: Full-time",https://www.indeed.com/m/viewjob?jk=8a0aca77fc5551f0,IndeedScraperUSAEng_8a0aca77fc5551f0,IndeedScraperUSAEng,Data,USA_ENGLISH,,UNKNOWN
NEW,Data Scientist,ROBUSTWARE INC,"Dallas, TX 75201",2024-11-26,"Acquiring data from disparate data sources using API's, SQL, and NoSQL. Background in data mining and statistical analysis. Transformation of data using SQL, NoSQL, and Python.","Job types: Full-time
Shifts: 8 hour shift
Benefits: Dental insurance, 401(k), Paid time off
Job types cc: Full-time
Schedules: 8 hour shift",https://www.indeed.com/m/viewjob?jk=d3607c0ecbe54147,IndeedScraperUSAEng_d3607c0ecbe54147,IndeedScraperUSAEng,Data,USA_ENGLISH,$104180 - $120116 yearly,UNKNOWN
NEW,Lead Tech Business Mgmt,AT&T,"Dallas, TX",2024-11-26,"Responsible for implementing, improving, supporting and leading the processes, strategies, and tools for the assigned technical business or technical functional area.","Job types: Full-time
Benefits: Paid parental leave, Caregiver leave, Paid holidays, Health insurance, Dental insurance, 401(k), Tuition reimbursement, Paid time off, Parental leave, Employee assistance program, Vision insurance, Employee discount
Job types cc: Full-time",https://www.indeed.com/m/viewjob?jk=4f96a930189f2336,IndeedScraperUSAEng_4f96a930189f2336,IndeedScraperUSAEng,Data,USA_ENGLISH,$106100 - $159100 yearly,UNKNOWN
NEW,Data Center Logistics Associate - 1st Shift,GXO Logistics,"Red Oak, TX 75154",2024-11-01,"Collaborate with cross-functional teams, including data center operations, procurement, and technical support, to fulfill inventory and logistics needs. To be at least 18 years of age.","Benefits: Health insurance, Dental insurance, Snacks provided, Vision insurance, Life insurance
Schedules: Overtime, Monday to Friday",https://www.indeed.com/m/viewjob?jk=f1a6c831b97e8e32,IndeedScraperUSAEng_f1a6c831b97e8e32,IndeedScraperUSAEng,Data,USA_ENGLISH,,UNKNOWN
NEW,Sr Data Modeler,Embtel Inc,"Dallas, TX 75342",2024-10-27,"We EMBTEL, Inc one of the fastest growing IT Staffing & Recruitment Company in the US. We are U.S. Federal Govt. approved vendor and Certified Minority Business Enterprise (MBE) company. We have an…",Remote: Hybrid work,https://www.indeed.com/m/viewjob?jk=ffc5c194ddd848e0,IndeedScraperUSAEng_ffc5c194ddd848e0,IndeedScraperUSAEng,Data,USA_ENGLISH,,TEMPORARILY_REMOTE
NEW,Order Entry,Trulite Glass and Aluminum Solutions,"Fort Worth, TX 76155",2024-11-26,You have excellent prior data entry experience. Provides order/data entry for the branch operations. Listening skills and data collection with attention to detail are essential.,"Shifts: Day shift
Benefits: Health savings account, Disability insurance, Health insurance, Dental insurance, Vision insurance, 401(k) matching, Benefits from day one, Life insurance
Schedules: Day shift",https://www.indeed.com/m/viewjob?jk=0efe0e9dc4ae1d5a,IndeedScraperUSAEng_0efe0e9dc4ae1d5a,IndeedScraperUSAEng,Data,USA_ENGLISH,$18 - $18 hourly,UNKNOWN
NEW,Data Verification Analyst,CorVel Corporation,"Dallas, TX 75231",2024-11-15,"The Data Verification Specialist is responsible for all bill review clerical functions, including mail, prepping and scanning medical bills, data entry, data verification and assisting with various…","Job types: Full-time
Remote: Hybrid work
Benefits: Health savings account, Disability insurance, Health insurance, Dental insurance, 401(k), Flexible spending account, Paid time off, Vision insurance, Opportunities for advancement, Life insurance
Job types cc: Full-time",https://www.indeed.com/m/viewjob?jk=a3ab9b5b93f35322,IndeedScraperUSAEng_a3ab9b5b93f35322,IndeedScraperUSAEng,Data,USA_ENGLISH,$12.77 - $22.36 hourly,TEMPORARILY_REMOTE
NEW,Sales Administration Data Analyst - Greenhouse Gas,PACCAR,"Denton, TX 76205",2024-11-21,"You will monitor diverse data sources, identifying and resolving discrepancies to ensure accuracy in GHG data and documentation. Perform data analysis to aid business decision making.","Benefits: Health savings account, AD&D insurance, Paid holidays, Disability insurance, Health insurance, Dental insurance, Flexible spending account, Tuition reimbursement, Paid time off, Pension plan, Employee assistance program, Vision insurance, 401(k) matching",https://www.indeed.com/m/viewjob?jk=5a276b0498ea7ade,IndeedScraperUSAEng_5a276b0498ea7ade,IndeedScraperUSAEng,Data,USA_ENGLISH,,UNKNOWN
NEW,Senior Big Data/Hadoop Engineer,Evaya Data Systems,"Allen, TX",2024-10-27,"Identify the right kind of data serialization techniques and data stores for persisting events. Implement measures to address data privacy, security and compliance.",,https://www.indeed.com/m/viewjob?jk=48ad5cb9de911303,IndeedScraperUSAEng_48ad5cb9de911303,IndeedScraperUSAEng,Data,USA_ENGLISH,,UNKNOWN
NEW,2025 | Americas | Dallas Metro Area | Corporate and Workplace Solutions | Summer Analyst,Goldman Sachs,"Dallas, TX 75201",2024-10-27,Our Summer Analyst Program is a nine to ten week summer internship for students pursuing a bachelors / graduate degree. You will be fully immersed in our day-to-day activities.,"Job types: Internship
Job types cc: Seasonal, Internship",https://www.indeed.com/m/viewjob?jk=8927bc18176e93a5,IndeedScraperUSAEng_8927bc18176e93a5,IndeedScraperUSAEng,Data,USA_ENGLISH,,UNKNOWN
NEW,Distinguished Machine Learning Engineer (Director IC),Capital One,"Plano, TX 75023",2024-10-27,Experience partnering with technology peers responsible for data architecture and distributed computing infrastructure/platforms. At least 10 years of experience designing and building data-intensive…,"Job types: Full-time
Job types cc: Full-time",https://www.indeed.com/m/viewjob?jk=67cc5bddae0281fd,IndeedScraperUSAEng_67cc5bddae0281fd,IndeedScraperUSAEng,Data,USA_ENGLISH,,UNKNOWN
NEW,Data Engineer/Python Developer,CAP Digisoft Solutions,"Frisco, TX 75033",2024-10-27,"Development of data structures, xml parsing using Python. Parsers written in Python for extracting useful data from the design database. Development of XMLs for several components which maintains data…","Job types: Full-time
Job types cc: Full-time",https://www.indeed.com/m/viewjob?jk=851525cd1dc01964,IndeedScraperUSAEng_851525cd1dc01964,IndeedScraperUSAEng,Data,USA_ENGLISH,,UNKNOWN
NEW,JOB ID 10900: Data Engineer,Slesha,"Irving, TX 75039",2024-10-27,"Design and develop data pipelines and data processing systems using Hadoop and related technologies such as Spark, Map Reduce, etc. Requirements: Master’s degree in CS, Electronics Engg, Electrical…",,https://www.indeed.com/m/viewjob?jk=f5bf2682d5963f38,IndeedScraperUSAEng_f5bf2682d5963f38,IndeedScraperUSAEng,Data,USA_ENGLISH,$120328 - $122000 yearly,UNKNOWN
NEW,2025 | Americas | Dallas Metro Area | Risk | New Analyst,Goldman Sachs,"Dallas, TX 75201",2024-10-27,Our New Analyst Program is a full-time program for final year undergraduate and graduate students. Gain the skills and knowledge necessary to support our businesses.,"Job types: Full-time
Job types cc: Full-time",https://www.indeed.com/m/viewjob?jk=1052965ba11e9689,IndeedScraperUSAEng_1052965ba11e9689,IndeedScraperUSAEng,Data,USA_ENGLISH,,UNKNOWN
NEW,Data Center Facility Technician,CBRE,"Southlake, TX",2024-10-27,"As a CBRE Data Center Technician, you will perform preventative maintenance and corrective repairs within a Data Center operation. This job is part of the Critical and Technical Services job function.","Job types: Full-time
Job types cc: Full-time
Schedules: Weekends as needed, Holidays",https://www.indeed.com/m/viewjob?jk=8cd29a308c4fa039,IndeedScraperUSAEng_8cd29a308c4fa039,IndeedScraperUSAEng,Data,USA_ENGLISH,,UNKNOWN
NEW,Data Center & Application Hosting Strategy - Architect,Total Systems Solutions Consulting Inc.,"Dallas, TX 75201",2024-11-19,You must be available 100% to work remote full-time 37.5 hours per week with availability Monday to Friday from 8:00am to 5:00pm in the Pacific Time Zone.*. Road map and Implementation Planning.,"Job types: Full-time
Shifts: 8 hour shift
Job types cc: Full-time
Schedules: 8 hour shift, Monday to Friday",https://www.indeed.com/m/viewjob?jk=a91b30b356cd5c33,IndeedScraperUSAEng_a91b30b356cd5c33,IndeedScraperUSAEng,Data,USA_ENGLISH,,UNKNOWN
NEW,Azure Data Architect,Sky Consulting,"Dallas, TX 75220",2024-11-19,"Strong expertise in developing and using tools to prepare, extract, and manipulate data, enabling the creation of connected datasets for analytical purposes (data warehousing).","Job types: Contract
Shifts: 8 hour shift
Job types cc: Contract
Schedules: 8 hour shift",https://www.indeed.com/m/viewjob?jk=8ceef09f81eafff9,IndeedScraperUSAEng_8ceef09f81eafff9,IndeedScraperUSAEng,Data,USA_ENGLISH,,UNKNOWN
NEW,Catalog Data Specialist,"BBB Industries, LLC","Dallas, TX",2024-11-08,"Assist in proofing catalog, data and application information to ensure our data is top quality. This position will be responsible providing catalog data for missing coverage, product data for…","Job types: Full-time
Job types cc: Full-time",https://www.indeed.com/m/viewjob?jk=052f823f943ccd55,IndeedScraperUSAEng_052f823f943ccd55,IndeedScraperUSAEng,Data,USA_ENGLISH,,UNKNOWN
NEW,Data Integrity Manager,Maya Management Group Llc,"Dallas, TX 75228",2024-10-27,"Communicate effectively across cross-functional teams to address data integrity concerns and continuous improvement. Organize, implement, and enforce correct data collection policies and methods.","Job types: Full-time
Job types cc: Full-time",https://www.indeed.com/m/viewjob?jk=4182389e6a8f7b9d,IndeedScraperUSAEng_4182389e6a8f7b9d,IndeedScraperUSAEng,Data,USA_ENGLISH,,UNKNOWN
NEW,Senior Analytics & Reporting Analyst,Health Care Service Corporation,"Richardson, TX",2024-11-06,Bachelor’s degree and 2 year experience in data analysis and information reporting data OR 4 year experience in data analysis and information reporting data. Work with both internal and external data.,"Job types: Full-time
Remote: Hybrid work
Job types cc: Full-time",https://www.indeed.com/m/viewjob?jk=96ec598f521a2c0b,IndeedScraperUSAEng_96ec598f521a2c0b,IndeedScraperUSAEng,Data,USA_ENGLISH,$58800 - $130100 yearly,TEMPORARILY_REMOTE
NEW,Asset Data Coordinator,The Amlon Group,"Plano, TX 75093",2024-11-07,Gather and organize data related to assets and maintenance tasks. Input data accurately into the CMMS to ensure it reflects current operational requirements. Project Duration: *4-5 weeks.,"Job types: Contract
Shifts: Day shift
Job types cc: Contract
Schedules: Day shift",https://www.indeed.com/m/viewjob?jk=282d5a96f111f4e8,IndeedScraperUSAEng_282d5a96f111f4e8,IndeedScraperUSAEng,Data,USA_ENGLISH,,UNKNOWN
NEW,Sr. Data Scientist,Anveta INC,"Dallas, TX 75209",2024-10-27,"Expert Data Scientist, Specializing in Machine Learning and AI. Proficiency in Python Programming, Including experience in Machine Learning libraries such as SCIKIT -LEARN, PyTorch, Tensorflow, and…","Job types: Contract
Shifts: 8 hour shift
Benefits: Health insurance, Dental insurance, 401(k)
Job types cc: Contract
Schedules: 8 hour shift",https://www.indeed.com/m/viewjob?jk=535968078d190c82,IndeedScraperUSAEng_535968078d190c82,IndeedScraperUSAEng,Data,USA_ENGLISH,$45 - $50 hourly,UNKNOWN
NEW,"Regional Manager, Data Center Strategic Negotiation",Google,"Addison, TX",2024-11-20,"The application window will be open until at least 27 November, 2024. This opportunity will remain online based on business needs which may be before or after the specified date.Note: By applying to…","Job types: Full-time
Job types cc: Full-time",https://www.indeed.com/m/viewjob?jk=ab871362fc11fef5,IndeedScraperUSAEng_ab871362fc11fef5,IndeedScraperUSAEng,Data,USA_ENGLISH,,UNKNOWN
NEW,CRM Data Assistant,Winstead,"Dallas, TX",2024-11-22,"Proficiency in CRM systems with a strong focus on data correction, quality control, and adherence to data governance best practices. Proven experience in a data management or CRM data role, preferably…",,https://www.indeed.com/m/viewjob?jk=6da7769688f059a0,IndeedScraperUSAEng_6da7769688f059a0,IndeedScraperUSAEng,Data,USA_ENGLISH,,UNKNOWN
NEW,Senior Data Business Intelligence and Visualization Analyst,Frontier Waste Solutions,"Dallas, TX 75201",2024-11-01,"Advises on new data infrastructure technologies, inclusive of data-warehousing, reporting, and analytics platforms. Builds and deploys processes that ensure timely data-loading that maintains accuracy…",,https://www.indeed.com/m/viewjob?jk=fe0a33a43218f483,IndeedScraperUSAEng_fe0a33a43218f483,IndeedScraperUSAEng,Data,USA_ENGLISH,,UNKNOWN
NEW,"Part-Time Data Specialist, Alumni Relations",Tyler Junior College,"Tyler, TX 75701",2024-10-27,Experience working with data and CRMs. Contribute to the creation of data reports. The data specialist will assist in the creation of data reports and mailing lists as needed to support events and…,"Job types: Part-time
Benefits: Life insurance
Job types cc: Part-time",https://www.indeed.com/m/viewjob?jk=9878393b6110c4e8,IndeedScraperUSAEng_9878393b6110c4e8,IndeedScraperUSAEng,Data,USA_ENGLISH,,UNKNOWN
NEW,Sr. Data Architect,Compile,"Irving, TX",2024-11-20,"Manage creation of data design deliverables including data models, data diagrams, data flows and corresponding data dictionary documentation. Influence projects to make decisions related to data…",,https://www.indeed.com/m/viewjob?jk=bcd73412b73520d7,IndeedScraperUSAEng_bcd73412b73520d7,IndeedScraperUSAEng,Data,USA_ENGLISH,$130400 - $217300 yearly,UNKNOWN
NEW,Data Engineer - Paid Search Initiatives,CVS Health,"Irving, TX 75039",2024-11-21,"Build and maintain an understanding of data flows, sources, and data transformations across multiple domains to ensure data is properly powering ongoing datasets for modeling and reporting dashboards.","Job types: Full-time
Remote: Hybrid work
Benefits: Store discount, Employee stock purchase plan, Paid holidays, Disability insurance, Health insurance, Dental insurance, 401(k), Paid time off, Vision insurance, Employee discount, Life insurance
Job types cc: Full-time",https://www.indeed.com/m/viewjob?jk=f2fc3ada8a54b7c9,IndeedScraperUSAEng_f2fc3ada8a54b7c9,IndeedScraperUSAEng,Data,USA_ENGLISH,$72100 - $158620 yearly,TEMPORARILY_REMOTE
NEW,2025 | Americas | Dallas Metro Area | Compliance | Summer Analyst,Goldman Sachs,"Dallas, TX 75201",2024-10-27,Our Summer Analyst Program is a nine to ten week summer internship for students pursuing a bachelors / graduate degree. You will be fully immersed in our day-to-day activities.,"Job types: Internship
Job types cc: Seasonal, Internship",https://www.indeed.com/m/viewjob?jk=675bfd7b560a5b76,IndeedScraperUSAEng_675bfd7b560a5b76,IndeedScraperUSAEng,Data,USA_ENGLISH,,UNKNOWN
NEW,Data Center Technician II,Evocative,"Plano, TX 75075",2024-11-05,Understanding of data center environmental systems and industry best practices. 2-3 years of experience in data center operations or a related IT role. This is a full-time position.,"Job types: Full-time
Job types cc: Full-time
Schedules: Overtime, Weekends as needed, Holidays",https://www.indeed.com/m/viewjob?jk=0fdfddacd70352da,IndeedScraperUSAEng_0fdfddacd70352da,IndeedScraperUSAEng,Data,USA_ENGLISH,,UNKNOWN
NEW,Big Data,Intone Networks,"Plano, TX",2024-10-27,"Experience working with large data sets, ETL, or applications that do high-volume data collection. HM Notes : Big data engineer with AWS experience / Java Python - combination of both More emphasis on…",,https://www.indeed.com/m/viewjob?jk=945b182c05507e2d,IndeedScraperUSAEng_945b182c05507e2d,IndeedScraperUSAEng,Data,USA_ENGLISH,,UNKNOWN
NEW,Police Records Clerk,Haltom City,"Haltom City, TX 76117",2024-11-15,This position performs a variety of clerical duties and records management functions in the Records Division of the Police Department. In this position you will process and maintain law enforcement…,"Job types: Full-time
Job types cc: Full-time",https://www.indeed.com/m/viewjob?jk=fff280083dad3ffe,IndeedScraperUSAEng_fff280083dad3ffe,IndeedScraperUSAEng,Data,USA_ENGLISH,$19.05 - $19.05 hourly,UNKNOWN
NEW,Data Entry Clerk,AOSS Medical Supply,"Richardson, TX 75082",2024-11-25,"Job Summary We are seeking a detail-oriented and organized Data Entry Clerk to join our team. The ideal candidate will be responsible for accurately entering, transcribing, and managing data…","Job types: Full-time
Shifts: 8 hour shift
Job types cc: Full-time
Schedules: 8 hour shift",https://www.indeed.com/m/viewjob?jk=346725e2a9b26750,IndeedScraperUSAEng_346725e2a9b26750,IndeedScraperUSAEng,Data,USA_ENGLISH,$16.21 - $17.2 hourly,UNKNOWN
NEW,"Data Scientist (12+ yrs exp.) || Dallas, TX (Local only) || F2F interview required.",ANB Sourcing LLC,"Dallas, TX 75201",2024-11-05,"Dallas, TX (Local only)- F2F interview required.. 12+ years of experience in Data Scientist*. Analyze existing programs or formulates logic for new systems, devises logic procedures, prepares…","Job types: Full-time, Contract
Shifts: 8 hour shift
Remote: Hybrid work
Job types cc: Full-time, Contract
Schedules: 8 hour shift",https://www.indeed.com/m/viewjob?jk=e36e7cf217d6531c,IndeedScraperUSAEng_e36e7cf217d6531c,IndeedScraperUSAEng,Data,USA_ENGLISH,$60 - $65 hourly,TEMPORARILY_REMOTE
NEW,Big Data Lead Engineer,Citi,"Irving, TX",2024-11-12,Work with data scientist to build Client pipelines using heterogeneous sources and provide engineering services for data science applications. 8+ years of experience in hadoop/big data technologies.,"Job types: Full-time
Benefits: Paid holidays, Disability insurance, Health insurance, Dental insurance, 401(k), Paid time off, Vision insurance
Job types cc: Full-time",https://www.indeed.com/m/viewjob?jk=f095ccb7c5b70c50,IndeedScraperUSAEng_f095ccb7c5b70c50,IndeedScraperUSAEng,Data,USA_ENGLISH,$125760 - $188640 yearly,UNKNOWN
NEW,Data Scientist- Generative AI Developer,SG INC CPA,"Plano, TX 75074",2024-11-13,"Experience with data storage solutions for AI workloads, such as HDFS or S3. The ideal candidate will leverage their expertise in data analysis and generative AI to drive insights and support decision…","Job types: Full-time
Shifts: 8 hour shift
Remote: Hybrid work
Job types cc: Full-time
Schedules: 8 hour shift, Monday to Friday",https://www.indeed.com/m/viewjob?jk=99f615b6ad06ab19,IndeedScraperUSAEng_99f615b6ad06ab19,IndeedScraperUSAEng,Data,USA_ENGLISH,,TEMPORARILY_REMOTE
NEW,Data/AI Product Manager,PepsiCo,"Plano, TX 75024",2024-10-27,"Building and executing seamlessly against data roadmaps for each data initiative. Build comprehensive data requirements and roadmaps,. Work with stewards, data engineering, data science and…","Benefits: Paid parental leave, Dependent care reimbursement, Health insurance, Dental insurance, Flexible spending account, Paid time off, Adoption assistance, Parental leave, Employee assistance program, Vision insurance, Retirement plan",https://www.indeed.com/m/viewjob?jk=fb3f2847817d44a9,IndeedScraperUSAEng_fb3f2847817d44a9,IndeedScraperUSAEng,Data,USA_ENGLISH,$125000 - $217500 yearly,UNKNOWN
NEW,SQL Data Analyst,Pomeroy,"Plano, TX 75024",2024-10-27,"Experience with advanced data analytics, data transformation and data management projects. Implements best practices in data management to ensure the integrity of the data, the quality of data…","Job types: Full-time, Contract
Shifts: 8 hour shift, Day shift
Job types cc: Full-time, Contract
Schedules: 8 hour shift, Day shift, Monday to Friday",https://www.indeed.com/m/viewjob?jk=12f337e53a26d645,IndeedScraperUSAEng_12f337e53a26d645,IndeedScraperUSAEng,Data,USA_ENGLISH,$40 - $45 hourly,UNKNOWN
NEW,Tableau Specialist,Realign LLC,"Dallas, TX",2024-11-14,Strong understanding of data visualization principles. Attention to detail and accuracy in data analysis. Analyze and understand complex data sources to provide actionable insights.,"Job types: Contract
Job types cc: Contract",https://www.indeed.com/m/viewjob?jk=9f72ebb40bf8cc83,IndeedScraperUSAEng_9f72ebb40bf8cc83,IndeedScraperUSAEng,Data,USA_ENGLISH,,UNKNOWN
NEW,GCP Data Engineer,emids,"Dallas, TX",2024-10-27,"Design and develop data infrastructure components such as data warehouses, data lakes, and data pipelines. A key responsibility is migrating historical data from Teradata to the new GCP system and…",,https://www.indeed.com/m/viewjob?jk=902f2207c7b1cc2e,IndeedScraperUSAEng_902f2207c7b1cc2e,IndeedScraperUSAEng,Data,USA_ENGLISH,,UNKNOWN
NEW,Data Integration Specialist,The Potter's House,"Dallas, TX 75236",2024-11-01,"Handle complex data requests, reports, and predictive data modeling. Collaborate with cross-functional teams to understand data requirements and implement automated data pipelines.","Job types: Full-time
Shifts: 8 hour shift
Benefits: Health insurance, Dental insurance, 401(k), Flexible spending account, Tuition reimbursement, Paid time off, Employee assistance program, Vision insurance, 401(k) matching, Life insurance
Job types cc: Full-time
Schedules: 8 hour shift, Monday to Friday",https://www.indeed.com/m/viewjob?jk=719a332bb9f2d9f2,IndeedScraperUSAEng_719a332bb9f2d9f2,IndeedScraperUSAEng,Data,USA_ENGLISH,,UNKNOWN
NEW,Clinical Data Coordinator - Entry Level - Mathematics Degree,"Medpace, Inc.","Irving, TX 75038",2024-10-27,Reconcile data from multiple sources. Report metrics and data trends on projects. Identify data conflicts and issues on projects. Work with personnel from global research sites to resolve data…,"Job types: Full-time
Benefits: Free parking, On-site gym, Paid time off
Job types cc: Full-time",https://www.indeed.com/m/viewjob?jk=35bc882b3a2809cd,IndeedScraperUSAEng_35bc882b3a2809cd,IndeedScraperUSAEng,Data,USA_ENGLISH,,UNKNOWN
NEW,SVP Chief Data and Analytics Officer,Children's Health,"Dallas, TX",2024-11-08,At least 10 years' experience in senior data analytics or data science position required. Build partnerships with executive leadership to establish the vision for managing data as a business asset to…,"Job types: Full-time
Benefits: Paid parental leave, Caregiver leave, Health insurance, Parental leave
Job types cc: Full-time",https://www.indeed.com/m/viewjob?jk=fafa9c9c3e94d595,IndeedScraperUSAEng_fafa9c9c3e94d595,IndeedScraperUSAEng,Data,USA_ENGLISH,,UNKNOWN
NEW,Remarketing Coordinator II (Data Entry),Avion Networks,"Lewisville, TX 75077",2024-10-27,Organize existing data in a spreadsheet. Provide data entry across departments on an ad-hoc basis. Assist with special projects that require large amounts of data entry.,,https://www.indeed.com/m/viewjob?jk=8fc8cb39d9732517,IndeedScraperUSAEng_8fc8cb39d9732517,IndeedScraperUSAEng,Data,USA_ENGLISH,,UNKNOWN
NEW,Oracle Database Admin,Hudson Manpower,"Dallas, TX",2024-10-27,HUGE PLUS if they have hospital or healthcare company experience because they will be working with patient data and healthcare systems on ORACLE databases. EST or CST time zone only!,"Job types: Full-time
Remote: Remote
Job types cc: Full-time",https://www.indeed.com/m/viewjob?jk=5968a79652a9a87d,IndeedScraperUSAEng_5968a79652a9a87d,IndeedScraperUSAEng,Data,USA_ENGLISH,,FULLY_REMOTE
NEW,Sr. Azure Data Engineer,Nuvem,"Plano, TX 75024",2024-10-27,Experience in data warehousing methodologies and dimensional data modeling. Experience with data analysis and profiling of source data while developing or. Data sourcing and source system analysis.,"Job types: Full-time
Job types cc: Full-time",https://www.indeed.com/m/viewjob?jk=a38350dce2019146,IndeedScraperUSAEng_a38350dce2019146,IndeedScraperUSAEng,Data,USA_ENGLISH,$115000 - $150000 yearly,UNKNOWN
